tcpdump: data link type PKTAP
tcpdump: verbose output suppressed, use -v[v]... for full protocol decode
listening on any, link-type PKTAP (Apple DLT_PKTAP), snapshot length 524288 bytes
17:35:45.912236 IP 10.44.0.112.57437 > 104.18.40.98.443: Flags [S], seq 1720868491, win 65535, options [mss 1460,nop,wscale 6,nop,nop,TS val 2294324391 ecr 0,sackOK,eol], length 0
17:35:45.927888 IP 104.18.40.98.443 > 10.44.0.112.57437: Flags [S.], seq 2808700898, ack 1720868492, win 65535, options [mss 1400,sackOK,TS val 3355568085 ecr 2294324391,nop,wscale 13], length 0
17:35:45.928023 IP 10.44.0.112.57437 > 104.18.40.98.443: Flags [.], ack 1, win 2060, options [nop,nop,TS val 2294324407 ecr 3355568085], length 0
17:35:45.936707 IP 10.44.0.112.57437 > 104.18.40.98.443: Flags [P.], seq 1:193, ack 1, win 2060, options [nop,nop,TS val 2294324416 ecr 3355568085], length 192
17:35:46.068982 IP 10.44.0.112.57437 > 104.18.40.98.443: Flags [P.], seq 1:193, ack 1, win 2060, options [nop,nop,TS val 2294324548 ecr 3355568085], length 192
17:35:46.126998 IP 104.18.40.98.443 > 10.44.0.112.57437: Flags [.], ack 193, win 16, options [nop,nop,TS val 3355568279 ecr 2294324416], length 0
17:35:46.134976 IP 104.18.40.98.443 > 10.44.0.112.57437: Flags [.], seq 1:1449, ack 193, win 16, options [nop,nop,TS val 3355568282 ecr 2294324416], length 1448
17:35:46.135087 IP 10.44.0.112.57437 > 104.18.40.98.443: Flags [.], ack 1449, win 2037, options [nop,nop,TS val 2294324614 ecr 3355568282], length 0
17:35:46.139869 IP 104.18.40.98.443 > 10.44.0.112.57437: Flags [P.], seq 1449:2756, ack 193, win 16, options [nop,nop,TS val 3355568282 ecr 2294324416], length 1307
17:35:46.139995 IP 10.44.0.112.57437 > 104.18.40.98.443: Flags [.], ack 2756, win 2027, options [nop,nop,TS val 2294324619 ecr 3355568282], length 0
17:35:46.143376 IP 10.44.0.112.57437 > 104.18.40.98.443: Flags [P.], seq 193:286, ack 2756, win 2048, options [nop,nop,TS val 2294324622 ecr 3355568282], length 93
17:35:46.158744 IP 104.18.40.98.443 > 10.44.0.112.57437: Flags [P.], seq 2756:2807, ack 286, win 16, options [nop,nop,TS val 3355568317 ecr 2294324622], length 51
17:35:46.158871 IP 10.44.0.112.57437 > 104.18.40.98.443: Flags [.], ack 2807, win 2047, options [nop,nop,TS val 2294324638 ecr 3355568317], length 0
17:35:46.162195 IP 10.44.0.112.57437 > 104.18.40.98.443: Flags [P.], seq 286:784, ack 2807, win 2048, options [nop,nop,TS val 2294324642 ecr 3355568317], length 498
17:35:46.162366 IP 10.44.0.112.57437 > 104.18.40.98.443: Flags [P.], seq 784:1024, ack 2807, win 2048, options [nop,nop,TS val 2294324642 ecr 3355568317], length 240
17:35:46.178177 IP 104.18.40.98.443 > 10.44.0.112.57437: Flags [.], ack 1024, win 16, options [nop,nop,TS val 3355568337 ecr 2294324642], length 0
17:35:46.243322 IP 104.18.40.98.443 > 10.44.0.112.57437: Flags [P.], seq 2807:3632, ack 1024, win 16, options [nop,nop,TS val 3355568397 ecr 2294324642], length 825
17:35:46.243437 IP 10.44.0.112.57437 > 104.18.40.98.443: Flags [.], ack 3632, win 2035, options [nop,nop,TS val 2294324723 ecr 3355568397], length 0
17:35:46.246855 IP 10.44.0.112.57437 > 104.18.40.98.443: Flags [F.], seq 1024, ack 3632, win 2048, options [nop,nop,TS val 2294324726 ecr 3355568397], length 0
17:35:46.267973 IP 104.18.40.98.443 > 10.44.0.112.57437: Flags [F.], seq 3632, ack 1025, win 16, options [nop,nop,TS val 3355568425 ecr 2294324726], length 0
17:35:46.268167 IP 10.44.0.112.57437 > 104.18.40.98.443: Flags [.], ack 3633, win 2048, options [nop,nop,TS val 2294324747 ecr 3355568425], length 0
17:35:49.338089 IP 10.44.0.112.57440 > 104.18.40.98.443: Flags [S], seq 3002379732, win 65535, options [mss 1460,nop,wscale 6,nop,nop,TS val 491241407 ecr 0,sackOK,eol], length 0
17:35:49.356880 IP 104.18.40.98.443 > 10.44.0.112.57440: Flags [S.], seq 288569993, ack 3002379733, win 65535, options [mss 1400,sackOK,TS val 1869613090 ecr 491241407,nop,wscale 13], length 0
17:35:49.356983 IP 10.44.0.112.57440 > 104.18.40.98.443: Flags [.], ack 1, win 2060, options [nop,nop,TS val 491241426 ecr 1869613090], length 0
17:35:49.364894 IP 10.44.0.112.57440 > 104.18.40.98.443: Flags [P.], seq 1:193, ack 1, win 2060, options [nop,nop,TS val 491241434 ecr 1869613090], length 192
17:35:49.382477 IP 104.18.40.98.443 > 10.44.0.112.57440: Flags [.], ack 193, win 16, options [nop,nop,TS val 1869613115 ecr 491241434], length 0
17:35:49.387656 IP 104.18.40.98.443 > 10.44.0.112.57440: Flags [.], seq 1:1449, ack 193, win 16, options [nop,nop,TS val 1869613120 ecr 491241434], length 1448
17:35:49.387734 IP 10.44.0.112.57440 > 104.18.40.98.443: Flags [.], ack 1449, win 2037, options [nop,nop,TS val 491241457 ecr 1869613120], length 0
17:35:49.393044 IP 104.18.40.98.443 > 10.44.0.112.57440: Flags [P.], seq 1449:2755, ack 193, win 16, options [nop,nop,TS val 1869613120 ecr 491241434], length 1306
17:35:49.393134 IP 10.44.0.112.57440 > 104.18.40.98.443: Flags [.], ack 2755, win 2027, options [nop,nop,TS val 491241462 ecr 1869613120], length 0
17:35:49.395678 IP 10.44.0.112.57440 > 104.18.40.98.443: Flags [P.], seq 193:286, ack 2755, win 2048, options [nop,nop,TS val 491241464 ecr 1869613120], length 93
17:35:49.422813 IP 104.18.40.98.443 > 10.44.0.112.57440: Flags [P.], seq 2755:2806, ack 286, win 16, options [nop,nop,TS val 1869613152 ecr 491241464], length 51
17:35:49.422929 IP 10.44.0.112.57440 > 104.18.40.98.443: Flags [.], ack 2806, win 2047, options [nop,nop,TS val 491241492 ecr 1869613152], length 0
17:35:49.423741 IP 10.44.0.112.57440 > 104.18.40.98.443: Flags [P.], seq 286:784, ack 2806, win 2048, options [nop,nop,TS val 491241492 ecr 1869613152], length 498
17:35:49.423837 IP 10.44.0.112.57440 > 104.18.40.98.443: Flags [P.], seq 784:1001, ack 2806, win 2048, options [nop,nop,TS val 491241492 ecr 1869613152], length 217
17:35:49.439442 IP 104.18.40.98.443 > 10.44.0.112.57440: Flags [.], ack 1001, win 16, options [nop,nop,TS val 1869613173 ecr 491241492], length 0
17:35:49.488623 IP 104.18.40.98.443 > 10.44.0.112.57440: Flags [P.], seq 2806:3631, ack 1001, win 16, options [nop,nop,TS val 1869613220 ecr 491241492], length 825
17:35:49.488702 IP 10.44.0.112.57440 > 104.18.40.98.443: Flags [.], ack 3631, win 2035, options [nop,nop,TS val 491241558 ecr 1869613220], length 0
17:35:49.491585 IP 10.44.0.112.57440 > 104.18.40.98.443: Flags [F.], seq 1001, ack 3631, win 2048, options [nop,nop,TS val 491241561 ecr 1869613220], length 0
17:35:49.518457 IP 104.18.40.98.443 > 10.44.0.112.57440: Flags [F.], seq 3631, ack 1002, win 16, options [nop,nop,TS val 1869613243 ecr 491241561], length 0
17:35:49.518597 IP 10.44.0.112.57440 > 104.18.40.98.443: Flags [.], ack 3632, win 2048, options [nop,nop,TS val 491241588 ecr 1869613243], length 0
17:35:52.563877 IP 10.44.0.112.57443 > 104.18.40.98.443: Flags [S], seq 389097431, win 65535, options [mss 1460,nop,wscale 6,nop,nop,TS val 1830510548 ecr 0,sackOK,eol], length 0
17:35:52.578502 IP 104.18.40.98.443 > 10.44.0.112.57443: Flags [S.], seq 1946469374, ack 389097432, win 65535, options [mss 1400,sackOK,TS val 3410137633 ecr 1830510548,nop,wscale 13], length 0
17:35:52.578614 IP 10.44.0.112.57443 > 104.18.40.98.443: Flags [.], ack 1, win 2060, options [nop,nop,TS val 1830510563 ecr 3410137633], length 0
17:35:52.584788 IP 10.44.0.112.57443 > 104.18.40.98.443: Flags [P.], seq 1:193, ack 1, win 2060, options [nop,nop,TS val 1830510569 ecr 3410137633], length 192
17:35:52.608580 IP 104.18.40.98.443 > 10.44.0.112.57443: Flags [.], ack 193, win 16, options [nop,nop,TS val 3410137660 ecr 1830510569], length 0
17:35:52.615707 IP 104.18.40.98.443 > 10.44.0.112.57443: Flags [.], seq 1:1449, ack 193, win 16, options [nop,nop,TS val 3410137664 ecr 1830510569], length 1448
17:35:52.615708 IP 104.18.40.98.443 > 10.44.0.112.57443: Flags [P.], seq 1449:2754, ack 193, win 16, options [nop,nop,TS val 3410137664 ecr 1830510569], length 1305
17:35:52.615778 IP 10.44.0.112.57443 > 104.18.40.98.443: Flags [.], ack 2754, win 2017, options [nop,nop,TS val 1830510600 ecr 3410137664], length 0
17:35:52.618200 IP 10.44.0.112.57443 > 104.18.40.98.443: Flags [P.], seq 193:286, ack 2754, win 2048, options [nop,nop,TS val 1830510602 ecr 3410137664], length 93
17:35:52.632380 IP 104.18.40.98.443 > 10.44.0.112.57443: Flags [P.], seq 2754:2805, ack 286, win 16, options [nop,nop,TS val 3410137687 ecr 1830510602], length 51
17:35:52.632488 IP 10.44.0.112.57443 > 104.18.40.98.443: Flags [.], ack 2805, win 2047, options [nop,nop,TS val 1830510617 ecr 3410137687], length 0
17:35:52.632921 IP 10.44.0.112.57443 > 104.18.40.98.443: Flags [P.], seq 286:784, ack 2805, win 2048, options [nop,nop,TS val 1830510617 ecr 3410137687], length 498
17:35:52.632952 IP 10.44.0.112.57443 > 104.18.40.98.443: Flags [P.], seq 784:1017, ack 2805, win 2048, options [nop,nop,TS val 1830510617 ecr 3410137687], length 233
17:35:52.648393 IP 104.18.40.98.443 > 10.44.0.112.57443: Flags [.], ack 1017, win 16, options [nop,nop,TS val 3410137703 ecr 1830510617], length 0
17:35:52.699425 IP 104.18.40.98.443 > 10.44.0.112.57443: Flags [P.], seq 2805:3630, ack 1017, win 16, options [nop,nop,TS val 3410137752 ecr 1830510617], length 825
17:35:52.699500 IP 10.44.0.112.57443 > 104.18.40.98.443: Flags [.], ack 3630, win 2035, options [nop,nop,TS val 1830510684 ecr 3410137752], length 0
17:35:52.701862 IP 10.44.0.112.57443 > 104.18.40.98.443: Flags [F.], seq 1017, ack 3630, win 2048, options [nop,nop,TS val 1830510686 ecr 3410137752], length 0
17:35:52.717078 IP 104.18.40.98.443 > 10.44.0.112.57443: Flags [F.], seq 3630, ack 1018, win 16, options [nop,nop,TS val 3410137772 ecr 1830510686], length 0
17:35:52.717265 IP 10.44.0.112.57443 > 104.18.40.98.443: Flags [.], ack 3631, win 2048, options [nop,nop,TS val 1830510701 ecr 3410137772], length 0
17:35:55.791543 IP 10.44.0.112.57444 > 104.18.40.98.443: Flags [S], seq 2590750504, win 65535, options [mss 1460,nop,wscale 6,nop,nop,TS val 2878785125 ecr 0,sackOK,eol], length 0
17:35:55.812247 IP 104.18.40.98.443 > 10.44.0.112.57444: Flags [S.], seq 3492042699, ack 2590750505, win 65535, options [mss 1400,sackOK,TS val 3159195890 ecr 2878785125,nop,wscale 13], length 0
17:35:55.812394 IP 10.44.0.112.57444 > 104.18.40.98.443: Flags [.], ack 1, win 2060, options [nop,nop,TS val 2878785146 ecr 3159195890], length 0
17:35:55.821698 IP 10.44.0.112.57444 > 104.18.40.98.443: Flags [P.], seq 1:193, ack 1, win 2060, options [nop,nop,TS val 2878785155 ecr 3159195890], length 192
17:35:55.840537 IP 104.18.40.98.443 > 10.44.0.112.57444: Flags [.], ack 193, win 16, options [nop,nop,TS val 3159195915 ecr 2878785155], length 0
17:35:55.840539 IP 104.18.40.98.443 > 10.44.0.112.57444: Flags [.], seq 1:1449, ack 193, win 16, options [nop,nop,TS val 3159195919 ecr 2878785155], length 1448
17:35:55.840666 IP 10.44.0.112.57444 > 104.18.40.98.443: Flags [.], ack 1449, win 2037, options [nop,nop,TS val 2878785174 ecr 3159195919], length 0
17:35:55.842943 IP 104.18.40.98.443 > 10.44.0.112.57444: Flags [P.], seq 1449:2755, ack 193, win 16, options [nop,nop,TS val 3159195919 ecr 2878785155], length 1306
17:35:55.843042 IP 10.44.0.112.57444 > 104.18.40.98.443: Flags [.], ack 2755, win 2027, options [nop,nop,TS val 2878785176 ecr 3159195919], length 0
17:35:55.848407 IP 10.44.0.112.57444 > 104.18.40.98.443: Flags [P.], seq 193:286, ack 2755, win 2048, options [nop,nop,TS val 2878785181 ecr 3159195919], length 93
17:35:55.867454 IP 104.18.40.98.443 > 10.44.0.112.57444: Flags [P.], seq 2755:2806, ack 286, win 16, options [nop,nop,TS val 3159195945 ecr 2878785181], length 51
17:35:55.867571 IP 10.44.0.112.57444 > 104.18.40.98.443: Flags [.], ack 2806, win 2047, options [nop,nop,TS val 2878785201 ecr 3159195945], length 0
17:35:55.868597 IP 10.44.0.112.57444 > 104.18.40.98.443: Flags [P.], seq 286:784, ack 2806, win 2048, options [nop,nop,TS val 2878785202 ecr 3159195945], length 498
17:35:55.868762 IP 10.44.0.112.57444 > 104.18.40.98.443: Flags [P.], seq 784:1006, ack 2806, win 2048, options [nop,nop,TS val 2878785202 ecr 3159195945], length 222
17:35:55.888434 IP 104.18.40.98.443 > 10.44.0.112.57444: Flags [.], ack 1006, win 16, options [nop,nop,TS val 3159195966 ecr 2878785202], length 0
17:35:55.931272 IP 104.18.40.98.443 > 10.44.0.112.57444: Flags [P.], seq 2806:3631, ack 1006, win 16, options [nop,nop,TS val 3159196009 ecr 2878785202], length 825
17:35:55.931348 IP 10.44.0.112.57444 > 104.18.40.98.443: Flags [.], ack 3631, win 2035, options [nop,nop,TS val 2878785265 ecr 3159196009], length 0
17:35:55.934131 IP 10.44.0.112.57444 > 104.18.40.98.443: Flags [F.], seq 1006, ack 3631, win 2048, options [nop,nop,TS val 2878785267 ecr 3159196009], length 0
17:35:55.958328 IP 104.18.40.98.443 > 10.44.0.112.57444: Flags [F.], seq 3631, ack 1007, win 16, options [nop,nop,TS val 3159196031 ecr 2878785267], length 0
17:35:55.958449 IP 10.44.0.112.57444 > 104.18.40.98.443: Flags [.], ack 3632, win 2048, options [nop,nop,TS val 2878785292 ecr 3159196031], length 0
17:35:59.011118 IP 10.44.0.112.57448 > 104.18.40.98.443: Flags [S], seq 2556934376, win 65535, options [mss 1460,nop,wscale 6,nop,nop,TS val 3366645225 ecr 0,sackOK,eol], length 0
17:35:59.027991 IP 104.18.40.98.443 > 10.44.0.112.57448: Flags [S.], seq 4180791617, ack 2556934377, win 65535, options [mss 1400,sackOK,TS val 356623390 ecr 3366645225,nop,wscale 13], length 0
17:35:59.028098 IP 10.44.0.112.57448 > 104.18.40.98.443: Flags [.], ack 1, win 2060, options [nop,nop,TS val 3366645242 ecr 356623390], length 0
17:35:59.034712 IP 10.44.0.112.57448 > 104.18.40.98.443: Flags [P.], seq 1:193, ack 1, win 2060, options [nop,nop,TS val 3366645249 ecr 356623390], length 192
17:35:59.050367 IP 104.18.40.98.443 > 10.44.0.112.57448: Flags [.], ack 193, win 16, options [nop,nop,TS val 356623412 ecr 3366645249], length 0
17:35:59.051552 IP 104.18.40.98.443 > 10.44.0.112.57448: Flags [.], seq 1:1449, ack 193, win 16, options [nop,nop,TS val 356623414 ecr 3366645249], length 1448
17:35:59.051554 IP 104.18.40.98.443 > 10.44.0.112.57448: Flags [P.], seq 1449:2756, ack 193, win 16, options [nop,nop,TS val 356623414 ecr 3366645249], length 1307
17:35:59.051611 IP 10.44.0.112.57448 > 104.18.40.98.443: Flags [.], ack 2756, win 2017, options [nop,nop,TS val 3366645266 ecr 356623414], length 0
17:35:59.054028 IP 10.44.0.112.57448 > 104.18.40.98.443: Flags [P.], seq 193:286, ack 2756, win 2048, options [nop,nop,TS val 3366645268 ecr 356623414], length 93
17:35:59.068997 IP 104.18.40.98.443 > 10.44.0.112.57448: Flags [P.], seq 2756:2807, ack 286, win 16, options [nop,nop,TS val 356623432 ecr 3366645268], length 51
17:35:59.069063 IP 10.44.0.112.57448 > 104.18.40.98.443: Flags [.], ack 2807, win 2047, options [nop,nop,TS val 3366645283 ecr 356623432], length 0
17:35:59.069510 IP 10.44.0.112.57448 > 104.18.40.98.443: Flags [P.], seq 286:784, ack 2807, win 2048, options [nop,nop,TS val 3366645283 ecr 356623432], length 498
17:35:59.069557 IP 10.44.0.112.57448 > 104.18.40.98.443: Flags [P.], seq 784:1012, ack 2807, win 2048, options [nop,nop,TS val 3366645283 ecr 356623432], length 228
17:35:59.086180 IP 104.18.40.98.443 > 10.44.0.112.57448: Flags [.], ack 1012, win 16, options [nop,nop,TS val 356623450 ecr 3366645283], length 0
17:35:59.144600 IP 104.18.40.98.443 > 10.44.0.112.57448: Flags [P.], seq 2807:3632, ack 1012, win 16, options [nop,nop,TS val 356623497 ecr 3366645283], length 825
17:35:59.144691 IP 10.44.0.112.57448 > 104.18.40.98.443: Flags [.], ack 3632, win 2035, options [nop,nop,TS val 3366645359 ecr 356623497], length 0
17:35:59.147257 IP 10.44.0.112.57448 > 104.18.40.98.443: Flags [F.], seq 1012, ack 3632, win 2048, options [nop,nop,TS val 3366645362 ecr 356623497], length 0
17:35:59.165727 IP 104.18.40.98.443 > 10.44.0.112.57448: Flags [F.], seq 3632, ack 1013, win 16, options [nop,nop,TS val 356623530 ecr 3366645362], length 0
17:35:59.165813 IP 10.44.0.112.57448 > 104.18.40.98.443: Flags [.], ack 3633, win 2048, options [nop,nop,TS val 3366645380 ecr 356623530], length 0
17:36:02.216880 IP 10.44.0.112.57453 > 104.18.40.98.443: Flags [S], seq 1040506386, win 65535, options [mss 1460,nop,wscale 6,nop,nop,TS val 548020303 ecr 0,sackOK,eol], length 0
17:36:02.236709 IP 104.18.40.98.443 > 10.44.0.112.57453: Flags [S.], seq 2666415987, ack 1040506387, win 65535, options [mss 1400,sackOK,TS val 1493785210 ecr 548020303,nop,wscale 13], length 0
17:36:02.236848 IP 10.44.0.112.57453 > 104.18.40.98.443: Flags [.], ack 1, win 2060, options [nop,nop,TS val 548020323 ecr 1493785210], length 0
17:36:02.244770 IP 10.44.0.112.57453 > 104.18.40.98.443: Flags [P.], seq 1:193, ack 1, win 2060, options [nop,nop,TS val 548020331 ecr 1493785210], length 192
17:36:02.261119 IP 104.18.40.98.443 > 10.44.0.112.57453: Flags [.], ack 193, win 16, options [nop,nop,TS val 1493785235 ecr 548020331], length 0
17:36:02.271541 IP 104.18.40.98.443 > 10.44.0.112.57453: Flags [.], seq 1:1449, ack 193, win 16, options [nop,nop,TS val 1493785243 ecr 548020331], length 1448
17:36:02.271542 IP 104.18.40.98.443 > 10.44.0.112.57453: Flags [P.], seq 1449:2756, ack 193, win 16, options [nop,nop,TS val 1493785243 ecr 548020331], length 1307
17:36:02.271620 IP 10.44.0.112.57453 > 104.18.40.98.443: Flags [.], ack 2756, win 2017, options [nop,nop,TS val 548020358 ecr 1493785243], length 0
17:36:02.274476 IP 10.44.0.112.57453 > 104.18.40.98.443: Flags [P.], seq 193:286, ack 2756, win 2048, options [nop,nop,TS val 548020360 ecr 1493785243], length 93
17:36:02.289688 IP 104.18.40.98.443 > 10.44.0.112.57453: Flags [P.], seq 2756:2807, ack 286, win 16, options [nop,nop,TS val 1493785263 ecr 548020360], length 51
17:36:02.289760 IP 10.44.0.112.57453 > 104.18.40.98.443: Flags [.], ack 2807, win 2047, options [nop,nop,TS val 548020376 ecr 1493785263], length 0
17:36:02.290439 IP 10.44.0.112.57453 > 104.18.40.98.443: Flags [P.], seq 286:784, ack 2807, win 2048, options [nop,nop,TS val 548020376 ecr 1493785263], length 498
17:36:02.290522 IP 10.44.0.112.57453 > 104.18.40.98.443: Flags [P.], seq 784:1018, ack 2807, win 2048, options [nop,nop,TS val 548020376 ecr 1493785263], length 234
17:36:02.305321 IP 104.18.40.98.443 > 10.44.0.112.57453: Flags [.], ack 1018, win 16, options [nop,nop,TS val 1493785278 ecr 548020376], length 0
17:36:02.380212 IP 104.18.40.98.443 > 10.44.0.112.57453: Flags [P.], seq 2807:3632, ack 1018, win 16, options [nop,nop,TS val 1493785353 ecr 548020376], length 825
17:36:02.380284 IP 10.44.0.112.57453 > 104.18.40.98.443: Flags [.], ack 3632, win 2035, options [nop,nop,TS val 548020467 ecr 1493785353], length 0
17:36:02.382608 IP 10.44.0.112.57453 > 104.18.40.98.443: Flags [F.], seq 1018, ack 3632, win 2048, options [nop,nop,TS val 548020469 ecr 1493785353], length 0
17:36:02.400319 IP 104.18.40.98.443 > 10.44.0.112.57453: Flags [F.], seq 3632, ack 1019, win 16, options [nop,nop,TS val 1493785373 ecr 548020469], length 0
17:36:02.400433 IP 10.44.0.112.57453 > 104.18.40.98.443: Flags [.], ack 3633, win 2048, options [nop,nop,TS val 548020487 ecr 1493785373], length 0
17:36:05.461137 IP 10.44.0.112.57456 > 104.18.40.98.443: Flags [S], seq 939883716, win 65535, options [mss 1460,nop,wscale 6,nop,nop,TS val 1335837801 ecr 0,sackOK,eol], length 0
17:36:05.485299 IP 104.18.40.98.443 > 10.44.0.112.57456: Flags [S.], seq 1278375953, ack 939883717, win 65535, options [mss 1400,sackOK,TS val 3651146080 ecr 1335837801,nop,wscale 13], length 0
17:36:05.485434 IP 10.44.0.112.57456 > 104.18.40.98.443: Flags [.], ack 1, win 2060, options [nop,nop,TS val 1335837826 ecr 3651146080], length 0
17:36:05.495234 IP 10.44.0.112.57456 > 104.18.40.98.443: Flags [P.], seq 1:193, ack 1, win 2060, options [nop,nop,TS val 1335837835 ecr 3651146080], length 192
17:36:05.514346 IP 104.18.40.98.443 > 10.44.0.112.57456: Flags [.], ack 193, win 16, options [nop,nop,TS val 3651146106 ecr 1335837835], length 0
17:36:05.521483 IP 104.18.40.98.443 > 10.44.0.112.57456: Flags [.], seq 1:1449, ack 193, win 16, options [nop,nop,TS val 3651146110 ecr 1335837835], length 1448
17:36:05.521485 IP 104.18.40.98.443 > 10.44.0.112.57456: Flags [P.], seq 1449:2755, ack 193, win 16, options [nop,nop,TS val 3651146110 ecr 1335837835], length 1306
17:36:05.521580 IP 10.44.0.112.57456 > 104.18.40.98.443: Flags [.], ack 2755, win 2017, options [nop,nop,TS val 1335837862 ecr 3651146110], length 0
17:36:05.525886 IP 10.44.0.112.57456 > 104.18.40.98.443: Flags [P.], seq 193:286, ack 2755, win 2048, options [nop,nop,TS val 1335837865 ecr 3651146110], length 93
17:36:05.540878 IP 104.18.40.98.443 > 10.44.0.112.57456: Flags [P.], seq 2755:2806, ack 286, win 16, options [nop,nop,TS val 3651146136 ecr 1335837865], length 51
17:36:05.541000 IP 10.44.0.112.57456 > 104.18.40.98.443: Flags [.], ack 2806, win 2047, options [nop,nop,TS val 1335837881 ecr 3651146136], length 0
17:36:05.541891 IP 10.44.0.112.57456 > 104.18.40.98.443: Flags [P.], seq 286:784, ack 2806, win 2048, options [nop,nop,TS val 1335837881 ecr 3651146136], length 498
17:36:05.541956 IP 10.44.0.112.57456 > 104.18.40.98.443: Flags [P.], seq 784:1012, ack 2806, win 2048, options [nop,nop,TS val 1335837882 ecr 3651146136], length 228
17:36:05.558223 IP 104.18.40.98.443 > 10.44.0.112.57456: Flags [.], ack 1012, win 16, options [nop,nop,TS val 3651146153 ecr 1335837881], length 0
17:36:05.640390 IP 104.18.40.98.443 > 10.44.0.112.57456: Flags [P.], seq 2806:3631, ack 1012, win 16, options [nop,nop,TS val 3651146236 ecr 1335837881], length 825
17:36:05.640495 IP 10.44.0.112.57456 > 104.18.40.98.443: Flags [.], ack 3631, win 2035, options [nop,nop,TS val 1335837981 ecr 3651146236], length 0
17:36:05.642762 IP 10.44.0.112.57456 > 104.18.40.98.443: Flags [F.], seq 1012, ack 3631, win 2048, options [nop,nop,TS val 1335837983 ecr 3651146236], length 0
17:36:05.659688 IP 104.18.40.98.443 > 10.44.0.112.57456: Flags [F.], seq 3631, ack 1013, win 16, options [nop,nop,TS val 3651146255 ecr 1335837983], length 0
17:36:05.659851 IP 10.44.0.112.57456 > 104.18.40.98.443: Flags [.], ack 3632, win 2048, options [nop,nop,TS val 1335838000 ecr 3651146255], length 0
17:36:08.709325 IP 10.44.0.112.57459 > 104.18.40.98.443: Flags [S], seq 2725443131, win 65535, options [mss 1460,nop,wscale 6,nop,nop,TS val 2422435421 ecr 0,sackOK,eol], length 0
17:36:08.732482 IP 104.18.40.98.443 > 10.44.0.112.57459: Flags [S.], seq 2284787322, ack 2725443132, win 65535, options [mss 1400,sackOK,TS val 1469618223 ecr 2422435421,nop,wscale 13], length 0
17:36:08.732616 IP 10.44.0.112.57459 > 104.18.40.98.443: Flags [.], ack 1, win 2060, options [nop,nop,TS val 2422435445 ecr 1469618223], length 0
17:36:08.740044 IP 10.44.0.112.57459 > 104.18.40.98.443: Flags [P.], seq 1:193, ack 1, win 2060, options [nop,nop,TS val 2422435452 ecr 1469618223], length 192
17:36:08.758384 IP 104.18.40.98.443 > 10.44.0.112.57459: Flags [.], ack 193, win 16, options [nop,nop,TS val 1469618247 ecr 2422435452], length 0
17:36:08.762153 IP 104.18.40.98.443 > 10.44.0.112.57459: Flags [.], seq 1:1449, ack 193, win 16, options [nop,nop,TS val 1469618251 ecr 2422435452], length 1448
17:36:08.762155 IP 104.18.40.98.443 > 10.44.0.112.57459: Flags [P.], seq 1449:2754, ack 193, win 16, options [nop,nop,TS val 1469618251 ecr 2422435452], length 1305
17:36:08.762251 IP 10.44.0.112.57459 > 104.18.40.98.443: Flags [.], ack 2754, win 2017, options [nop,nop,TS val 2422435474 ecr 1469618251], length 0
17:36:08.765143 IP 10.44.0.112.57459 > 104.18.40.98.443: Flags [P.], seq 193:286, ack 2754, win 2048, options [nop,nop,TS val 2422435477 ecr 1469618251], length 93
17:36:08.784497 IP 104.18.40.98.443 > 10.44.0.112.57459: Flags [P.], seq 2754:2805, ack 286, win 16, options [nop,nop,TS val 1469618275 ecr 2422435477], length 51
17:36:08.784618 IP 10.44.0.112.57459 > 104.18.40.98.443: Flags [.], ack 2805, win 2047, options [nop,nop,TS val 2422435497 ecr 1469618275], length 0
17:36:08.785586 IP 10.44.0.112.57459 > 104.18.40.98.443: Flags [P.], seq 286:784, ack 2805, win 2048, options [nop,nop,TS val 2422435497 ecr 1469618275], length 498
17:36:08.785763 IP 10.44.0.112.57459 > 104.18.40.98.443: Flags [P.], seq 784:1006, ack 2805, win 2048, options [nop,nop,TS val 2422435498 ecr 1469618275], length 222
17:36:08.802166 IP 104.18.40.98.443 > 10.44.0.112.57459: Flags [.], ack 1006, win 16, options [nop,nop,TS val 1469618293 ecr 2422435497], length 0
17:36:08.851252 IP 104.18.40.98.443 > 10.44.0.112.57459: Flags [P.], seq 2805:3630, ack 1006, win 16, options [nop,nop,TS val 1469618343 ecr 2422435497], length 825
17:36:08.851372 IP 10.44.0.112.57459 > 104.18.40.98.443: Flags [.], ack 3630, win 2035, options [nop,nop,TS val 2422435564 ecr 1469618343], length 0
17:36:08.853645 IP 10.44.0.112.57459 > 104.18.40.98.443: Flags [F.], seq 1006, ack 3630, win 2048, options [nop,nop,TS val 2422435566 ecr 1469618343], length 0
17:36:08.872761 IP 104.18.40.98.443 > 10.44.0.112.57459: Flags [F.], seq 3630, ack 1007, win 16, options [nop,nop,TS val 1469618366 ecr 2422435566], length 0
17:36:08.872872 IP 10.44.0.112.57459 > 104.18.40.98.443: Flags [.], ack 3631, win 2048, options [nop,nop,TS val 2422435585 ecr 1469618366], length 0
17:36:11.981574 IP 10.44.0.112.57462 > 104.18.40.98.443: Flags [S], seq 2391834443, win 65535, options [mss 1460,nop,wscale 6,nop,nop,TS val 3899693093 ecr 0,sackOK,eol], length 0
17:36:12.003130 IP 104.18.40.98.443 > 10.44.0.112.57462: Flags [S.], seq 1669857259, ack 2391834444, win 65535, options [mss 1400,sackOK,TS val 981338372 ecr 3899693093,nop,wscale 13], length 0
17:36:12.003261 IP 10.44.0.112.57462 > 104.18.40.98.443: Flags [.], ack 1, win 2060, options [nop,nop,TS val 3899693115 ecr 981338372], length 0
17:36:12.008836 IP 10.44.0.112.57462 > 104.18.40.98.443: Flags [P.], seq 1:193, ack 1, win 2060, options [nop,nop,TS val 3899693121 ecr 981338372], length 192
17:36:12.033463 IP 104.18.40.98.443 > 10.44.0.112.57462: Flags [.], ack 193, win 16, options [nop,nop,TS val 981338400 ecr 3899693121], length 0
17:36:12.033464 IP 104.18.40.98.443 > 10.44.0.112.57462: Flags [.], seq 1:1449, ack 193, win 16, options [nop,nop,TS val 981338403 ecr 3899693121], length 1448
17:36:12.033529 IP 10.44.0.112.57462 > 104.18.40.98.443: Flags [.], ack 1449, win 2037, options [nop,nop,TS val 3899693146 ecr 981338403], length 0
17:36:12.033686 IP 104.18.40.98.443 > 10.44.0.112.57462: Flags [P.], seq 1449:2756, ack 193, win 16, options [nop,nop,TS val 981338403 ecr 3899693121], length 1307
17:36:12.033723 IP 10.44.0.112.57462 > 104.18.40.98.443: Flags [.], ack 2756, win 2027, options [nop,nop,TS val 3899693146 ecr 981338403], length 0
17:36:12.036110 IP 10.44.0.112.57462 > 104.18.40.98.443: Flags [P.], seq 193:286, ack 2756, win 2048, options [nop,nop,TS val 3899693148 ecr 981338403], length 93
17:36:12.059951 IP 104.18.40.98.443 > 10.44.0.112.57462: Flags [P.], seq 2756:2807, ack 286, win 16, options [nop,nop,TS val 981338426 ecr 3899693148], length 51
17:36:12.060080 IP 10.44.0.112.57462 > 104.18.40.98.443: Flags [.], ack 2807, win 2047, options [nop,nop,TS val 3899693172 ecr 981338426], length 0
17:36:12.060642 IP 10.44.0.112.57462 > 104.18.40.98.443: Flags [P.], seq 286:784, ack 2807, win 2048, options [nop,nop,TS val 3899693172 ecr 981338426], length 498
17:36:12.060675 IP 10.44.0.112.57462 > 104.18.40.98.443: Flags [P.], seq 784:1028, ack 2807, win 2048, options [nop,nop,TS val 3899693172 ecr 981338426], length 244
17:36:12.086282 IP 104.18.40.98.443 > 10.44.0.112.57462: Flags [.], ack 1028, win 16, options [nop,nop,TS val 981338452 ecr 3899693172], length 0
17:36:12.120786 IP 104.18.40.98.443 > 10.44.0.112.57462: Flags [P.], seq 2807:3632, ack 1028, win 16, options [nop,nop,TS val 981338491 ecr 3899693172], length 825
17:36:12.120881 IP 10.44.0.112.57462 > 104.18.40.98.443: Flags [.], ack 3632, win 2035, options [nop,nop,TS val 3899693233 ecr 981338491], length 0
17:36:12.122250 IP 10.44.0.112.57462 > 104.18.40.98.443: Flags [F.], seq 1028, ack 3632, win 2048, options [nop,nop,TS val 3899693234 ecr 981338491], length 0
17:36:12.141769 IP 104.18.40.98.443 > 10.44.0.112.57462: Flags [F.], seq 3632, ack 1029, win 16, options [nop,nop,TS val 981338515 ecr 3899693234], length 0
17:36:12.141932 IP 10.44.0.112.57462 > 104.18.40.98.443: Flags [.], ack 3633, win 2048, options [nop,nop,TS val 3899693254 ecr 981338515], length 0
17:36:15.189283 IP 10.44.0.112.57463 > 104.18.40.98.443: Flags [S], seq 718461877, win 65535, options [mss 1460,nop,wscale 6,nop,nop,TS val 2982839199 ecr 0,sackOK,eol], length 0
17:36:15.233518 IP 104.18.40.98.443 > 10.44.0.112.57463: Flags [S.], seq 1834143061, ack 718461878, win 65535, options [mss 1400,sackOK,TS val 927722216 ecr 2982839199,nop,wscale 13], length 0
17:36:15.233660 IP 10.44.0.112.57463 > 104.18.40.98.443: Flags [.], ack 1, win 2060, options [nop,nop,TS val 2982839244 ecr 927722216], length 0
17:36:15.243226 IP 10.44.0.112.57463 > 104.18.40.98.443: Flags [P.], seq 1:193, ack 1, win 2060, options [nop,nop,TS val 2982839253 ecr 927722216], length 192
17:36:15.260201 IP 104.18.40.98.443 > 10.44.0.112.57463: Flags [.], ack 193, win 16, options [nop,nop,TS val 927722266 ecr 2982839253], length 0
17:36:15.265558 IP 104.18.40.98.443 > 10.44.0.112.57463: Flags [.], seq 1:1449, ack 193, win 16, options [nop,nop,TS val 927722271 ecr 2982839253], length 1448
17:36:15.265560 IP 104.18.40.98.443 > 10.44.0.112.57463: Flags [P.], seq 1449:2755, ack 193, win 16, options [nop,nop,TS val 927722271 ecr 2982839253], length 1306
17:36:15.265642 IP 10.44.0.112.57463 > 104.18.40.98.443: Flags [.], ack 2755, win 2017, options [nop,nop,TS val 2982839276 ecr 927722271], length 0
17:36:15.268448 IP 10.44.0.112.57463 > 104.18.40.98.443: Flags [P.], seq 193:286, ack 2755, win 2048, options [nop,nop,TS val 2982839278 ecr 927722271], length 93
17:36:15.284986 IP 104.18.40.98.443 > 10.44.0.112.57463: Flags [P.], seq 2755:2806, ack 286, win 16, options [nop,nop,TS val 927722292 ecr 2982839278], length 51
17:36:15.285088 IP 10.44.0.112.57463 > 104.18.40.98.443: Flags [.], ack 2806, win 2047, options [nop,nop,TS val 2982839295 ecr 927722292], length 0
17:36:15.285881 IP 10.44.0.112.57463 > 104.18.40.98.443: Flags [P.], seq 286:784, ack 2806, win 2048, options [nop,nop,TS val 2982839295 ecr 927722292], length 498
17:36:15.286006 IP 10.44.0.112.57463 > 104.18.40.98.443: Flags [P.], seq 784:1029, ack 2806, win 2048, options [nop,nop,TS val 2982839295 ecr 927722292], length 245
17:36:15.300278 IP 104.18.40.98.443 > 10.44.0.112.57463: Flags [.], ack 1029, win 16, options [nop,nop,TS val 927722306 ecr 2982839295], length 0
17:36:15.351605 IP 104.18.40.98.443 > 10.44.0.112.57463: Flags [P.], seq 2806:3631, ack 1029, win 16, options [nop,nop,TS val 927722358 ecr 2982839295], length 825
17:36:15.351700 IP 10.44.0.112.57463 > 104.18.40.98.443: Flags [.], ack 3631, win 2035, options [nop,nop,TS val 2982839362 ecr 927722358], length 0
17:36:15.354429 IP 10.44.0.112.57463 > 104.18.40.98.443: Flags [F.], seq 1029, ack 3631, win 2048, options [nop,nop,TS val 2982839365 ecr 927722358], length 0
17:36:15.372315 IP 104.18.40.98.443 > 10.44.0.112.57463: Flags [F.], seq 3631, ack 1030, win 16, options [nop,nop,TS val 927722379 ecr 2982839365], length 0
17:36:15.372477 IP 10.44.0.112.57463 > 104.18.40.98.443: Flags [.], ack 3632, win 2048, options [nop,nop,TS val 2982839383 ecr 927722379], length 0
17:36:18.431693 IP 10.44.0.112.57466 > 104.18.40.98.443: Flags [S], seq 2849767374, win 65535, options [mss 1460,nop,wscale 6,nop,nop,TS val 422638263 ecr 0,sackOK,eol], length 0
17:36:18.450407 IP 104.18.40.98.443 > 10.44.0.112.57466: Flags [S.], seq 883368472, ack 2849767375, win 65535, options [mss 1400,sackOK,TS val 1256902702 ecr 422638263,nop,wscale 13], length 0
17:36:18.450546 IP 10.44.0.112.57466 > 104.18.40.98.443: Flags [.], ack 1, win 2060, options [nop,nop,TS val 422638282 ecr 1256902702], length 0
17:36:18.460131 IP 10.44.0.112.57466 > 104.18.40.98.443: Flags [P.], seq 1:193, ack 1, win 2060, options [nop,nop,TS val 422638291 ecr 1256902702], length 192
17:36:18.473493 IP 104.18.40.98.443 > 10.44.0.112.57466: Flags [.], ack 193, win 16, options [nop,nop,TS val 1256902726 ecr 422638291], length 0
17:36:18.479118 IP 104.18.40.98.443 > 10.44.0.112.57466: Flags [.], seq 1:1449, ack 193, win 16, options [nop,nop,TS val 1256902729 ecr 422638291], length 1448
17:36:18.479120 IP 104.18.40.98.443 > 10.44.0.112.57466: Flags [P.], seq 1449:2754, ack 193, win 16, options [nop,nop,TS val 1256902729 ecr 422638291], length 1305
17:36:18.479220 IP 10.44.0.112.57466 > 104.18.40.98.443: Flags [.], ack 2754, win 2017, options [nop,nop,TS val 422638310 ecr 1256902729], length 0
17:36:18.482720 IP 10.44.0.112.57466 > 104.18.40.98.443: Flags [P.], seq 193:286, ack 2754, win 2048, options [nop,nop,TS val 422638313 ecr 1256902729], length 93
17:36:18.500325 IP 104.18.40.98.443 > 10.44.0.112.57466: Flags [P.], seq 2754:2805, ack 286, win 16, options [nop,nop,TS val 1256902749 ecr 422638313], length 51
17:36:18.500446 IP 10.44.0.112.57466 > 104.18.40.98.443: Flags [.], ack 2805, win 2047, options [nop,nop,TS val 422638332 ecr 1256902749], length 0
17:36:18.501514 IP 10.44.0.112.57466 > 104.18.40.98.443: Flags [P.], seq 286:784, ack 2805, win 2048, options [nop,nop,TS val 422638333 ecr 1256902749], length 498
17:36:18.501674 IP 10.44.0.112.57466 > 104.18.40.98.443: Flags [P.], seq 784:1023, ack 2805, win 2048, options [nop,nop,TS val 422638333 ecr 1256902749], length 239
17:36:18.525504 IP 104.18.40.98.443 > 10.44.0.112.57466: Flags [.], ack 1023, win 16, options [nop,nop,TS val 1256902777 ecr 422638333], length 0
17:36:18.596095 IP 104.18.40.98.443 > 10.44.0.112.57466: Flags [P.], seq 2805:3630, ack 1023, win 16, options [nop,nop,TS val 1256902848 ecr 422638333], length 825
17:36:18.596214 IP 10.44.0.112.57466 > 104.18.40.98.443: Flags [.], ack 3630, win 2035, options [nop,nop,TS val 422638427 ecr 1256902848], length 0
17:36:18.599203 IP 10.44.0.112.57466 > 104.18.40.98.443: Flags [F.], seq 1023, ack 3630, win 2048, options [nop,nop,TS val 422638430 ecr 1256902848], length 0
17:36:18.620542 IP 104.18.40.98.443 > 10.44.0.112.57466: Flags [F.], seq 3630, ack 1024, win 16, options [nop,nop,TS val 1256902872 ecr 422638430], length 0
17:36:18.620681 IP 10.44.0.112.57466 > 104.18.40.98.443: Flags [.], ack 3631, win 2048, options [nop,nop,TS val 422638452 ecr 1256902872], length 0
17:36:21.674102 IP 10.44.0.112.57469 > 104.18.40.98.443: Flags [S], seq 2121307677, win 65535, options [mss 1460,nop,wscale 6,nop,nop,TS val 4073756369 ecr 0,sackOK,eol], length 0
17:36:21.706749 IP 104.18.40.98.443 > 10.44.0.112.57469: Flags [S.], seq 1028609422, ack 2121307678, win 65535, options [mss 1400,sackOK,TS val 3083730098 ecr 4073756369,nop,wscale 13], length 0
17:36:21.706868 IP 10.44.0.112.57469 > 104.18.40.98.443: Flags [.], ack 1, win 2060, options [nop,nop,TS val 4073756402 ecr 3083730098], length 0
17:36:21.715921 IP 10.44.0.112.57469 > 104.18.40.98.443: Flags [P.], seq 1:193, ack 1, win 2060, options [nop,nop,TS val 4073756411 ecr 3083730098], length 192
17:36:21.731342 IP 104.18.40.98.443 > 10.44.0.112.57469: Flags [.], ack 193, win 16, options [nop,nop,TS val 3083730136 ecr 4073756411], length 0
17:36:21.736774 IP 104.18.40.98.443 > 10.44.0.112.57469: Flags [.], seq 1:1449, ack 193, win 16, options [nop,nop,TS val 3083730140 ecr 4073756411], length 1448
17:36:21.736872 IP 10.44.0.112.57469 > 104.18.40.98.443: Flags [.], ack 1449, win 2037, options [nop,nop,TS val 4073756432 ecr 3083730140], length 0
17:36:21.738968 IP 104.18.40.98.443 > 10.44.0.112.57469: Flags [P.], seq 1449:2755, ack 193, win 16, options [nop,nop,TS val 3083730140 ecr 4073756411], length 1306
17:36:21.739063 IP 10.44.0.112.57469 > 104.18.40.98.443: Flags [.], ack 2755, win 2027, options [nop,nop,TS val 4073756434 ecr 3083730140], length 0
17:36:21.742820 IP 10.44.0.112.57469 > 104.18.40.98.443: Flags [P.], seq 193:286, ack 2755, win 2048, options [nop,nop,TS val 4073756437 ecr 3083730140], length 93
17:36:21.769611 IP 104.18.40.98.443 > 10.44.0.112.57469: Flags [P.], seq 2755:2806, ack 286, win 16, options [nop,nop,TS val 3083730170 ecr 4073756437], length 51
17:36:21.769719 IP 10.44.0.112.57469 > 104.18.40.98.443: Flags [.], ack 2806, win 2047, options [nop,nop,TS val 4073756465 ecr 3083730170], length 0
17:36:21.771456 IP 10.44.0.112.57469 > 104.18.40.98.443: Flags [P.], seq 286:784, ack 2806, win 2048, options [nop,nop,TS val 4073756467 ecr 3083730170], length 498
17:36:21.771617 IP 10.44.0.112.57469 > 104.18.40.98.443: Flags [P.], seq 784:1018, ack 2806, win 2048, options [nop,nop,TS val 4073756467 ecr 3083730170], length 234
17:36:21.793567 IP 104.18.40.98.443 > 10.44.0.112.57469: Flags [.], ack 1018, win 16, options [nop,nop,TS val 3083730197 ecr 4073756467], length 0
17:36:21.837316 IP 104.18.40.98.443 > 10.44.0.112.57469: Flags [P.], seq 2806:3631, ack 1018, win 16, options [nop,nop,TS val 3083730239 ecr 4073756467], length 825
17:36:21.837434 IP 10.44.0.112.57469 > 104.18.40.98.443: Flags [.], ack 3631, win 2035, options [nop,nop,TS val 4073756533 ecr 3083730239], length 0
17:36:21.842142 IP 10.44.0.112.57469 > 104.18.40.98.443: Flags [F.], seq 1018, ack 3631, win 2048, options [nop,nop,TS val 4073756537 ecr 3083730239], length 0
17:36:21.865816 IP 104.18.40.98.443 > 10.44.0.112.57469: Flags [F.], seq 3631, ack 1019, win 16, options [nop,nop,TS val 3083730269 ecr 4073756537], length 0
17:36:21.865958 IP 10.44.0.112.57469 > 104.18.40.98.443: Flags [.], ack 3632, win 2048, options [nop,nop,TS val 4073756561 ecr 3083730269], length 0
17:36:24.924893 IP 10.44.0.112.57474 > 104.18.40.98.443: Flags [S], seq 2619942703, win 65535, options [mss 1460,nop,wscale 6,nop,nop,TS val 305824413 ecr 0,sackOK,eol], length 0
17:36:24.955989 IP 104.18.40.98.443 > 10.44.0.112.57474: Flags [S.], seq 4260366426, ack 2619942704, win 65535, options [mss 1400,sackOK,TS val 3336977935 ecr 305824413,nop,wscale 13], length 0
17:36:24.956114 IP 10.44.0.112.57474 > 104.18.40.98.443: Flags [.], ack 1, win 2060, options [nop,nop,TS val 305824444 ecr 3336977935], length 0
17:36:24.963498 IP 10.44.0.112.57474 > 104.18.40.98.443: Flags [P.], seq 1:193, ack 1, win 2060, options [nop,nop,TS val 305824452 ecr 3336977935], length 192
17:36:24.980187 IP 104.18.40.98.443 > 10.44.0.112.57474: Flags [.], ack 193, win 16, options [nop,nop,TS val 3336977966 ecr 305824452], length 0
17:36:24.985357 IP 104.18.40.98.443 > 10.44.0.112.57474: Flags [.], seq 1:1449, ack 193, win 16, options [nop,nop,TS val 3336977971 ecr 305824452], length 1448
17:36:24.985430 IP 10.44.0.112.57474 > 104.18.40.98.443: Flags [.], ack 1449, win 2037, options [nop,nop,TS val 305824474 ecr 3336977971], length 0
17:36:24.986131 IP 104.18.40.98.443 > 10.44.0.112.57474: Flags [P.], seq 1449:2755, ack 193, win 16, options [nop,nop,TS val 3336977971 ecr 305824452], length 1306
17:36:24.986172 IP 10.44.0.112.57474 > 104.18.40.98.443: Flags [.], ack 2755, win 2027, options [nop,nop,TS val 305824474 ecr 3336977971], length 0
17:36:24.988709 IP 10.44.0.112.57474 > 104.18.40.98.443: Flags [P.], seq 193:286, ack 2755, win 2048, options [nop,nop,TS val 305824476 ecr 3336977971], length 93
17:36:25.004013 IP 104.18.40.98.443 > 10.44.0.112.57474: Flags [P.], seq 2755:2806, ack 286, win 16, options [nop,nop,TS val 3336977990 ecr 305824476], length 51
17:36:25.004113 IP 10.44.0.112.57474 > 104.18.40.98.443: Flags [.], ack 2806, win 2047, options [nop,nop,TS val 305824492 ecr 3336977990], length 0
17:36:25.004878 IP 10.44.0.112.57474 > 104.18.40.98.443: Flags [P.], seq 286:784, ack 2806, win 2048, options [nop,nop,TS val 305824492 ecr 3336977990], length 498
17:36:25.004987 IP 10.44.0.112.57474 > 104.18.40.98.443: Flags [P.], seq 784:1000, ack 2806, win 2048, options [nop,nop,TS val 305824492 ecr 3336977990], length 216
17:36:25.019983 IP 104.18.40.98.443 > 10.44.0.112.57474: Flags [.], ack 1000, win 16, options [nop,nop,TS val 3336978006 ecr 305824492], length 0
17:36:25.112719 IP 104.18.40.98.443 > 10.44.0.112.57474: Flags [P.], seq 2806:3631, ack 1000, win 16, options [nop,nop,TS val 3336978096 ecr 305824492], length 825
